{"contract":"typaxis.machine-fixture-matrix/1","fixtures":[{"expected":"profiles/columns-1/combined/expected.json","fixture_id":"columns-1.combined"},{"expected":"profiles/float-1/combined/expected.json","fixture_id":"float-1.combined"},{"expected":"profiles/footnote-1/combined/expected.json","fixture_id":"footnote-1.combined"},{"expected":"profiles/header-footer-1/combined/expected.json","fixture_id":"header-footer-1.combined"},{"expected":"profiles/table-1/combined/expected.json","fixture_id":"table-1.combined"}],"profile":"typaxis.machine-pdf/m3-all","rows":[{"fixture_ids":["columns-1.combined","float-1.combined","footnote-1.combined","header-footer-1.combined","table-1.combined"],"id":"m3-all-combined","test":"machine_tests::machine_m3_all_combined_public_profiles"}],"verification_commands":["cargo test --manifest-path workspace/Cargo.toml --package typaxis-cli machine --locked","cargo test --manifest-path workspace/Cargo.toml --package typaxis-document-package --locked","python3 schemas/validate.py"]}