{"contract":"typaxis.machine-fixture-matrix/1","fixtures":[{"expected":"profiles/footnote-1/combined/expected.json","fixture_id":"footnote-1.combined"},{"expected":"invalid/footnote-1-old-contract/expected.json","fixture_id":"footnote-1.old-contract-rejected"},{"expected":"profiles/footnote-1/zero/expected.json","fixture_id":"footnote-1.zero"}],"profile":"typaxis.machine-pdf/footnote-1","rows":[{"fixture_ids":["footnote-1.zero"],"id":"m3-footnote-zero","test":"machine_tests::machine_footnote_zero"},{"fixture_ids":["footnote-1.combined"],"id":"m3-footnote-combined","test":"machine_tests::machine_footnote_combined"},{"fixture_ids":["footnote-1.old-contract-rejected"],"id":"m3-footnote-old-contract","test":"machine_tests::machine_footnote_old_contract_rejected"}],"verification_commands":["cargo test --manifest-path workspace/Cargo.toml --package typaxis-cli machine --locked","cargo test --manifest-path workspace/Cargo.toml --package typaxis-document-package --locked","python3 schemas/validate.py"]}