{"contract":"typaxis.machine-fixture-matrix/1","fixtures":[{"expected":"profiles/float-1/combined/expected.json","fixture_id":"float-1.combined"}],"profile":"typaxis.machine-pdf/float-1","rows":[{"fixture_ids":["float-1.combined"],"id":"m3-float-1-combined","test":"machine_tests::machine_float_1_combined_public_profile"}],"verification_commands":["cargo test --manifest-path workspace/Cargo.toml --package typaxis-cli machine --locked","cargo test --manifest-path workspace/Cargo.toml --package typaxis-document-package --locked","python3 schemas/validate.py"]}