{"contract":"typaxis.machine-fixture-matrix/1","fixtures":[{"expected":"profiles/header-footer-1/combined/expected.json","fixture_id":"header-footer-1.combined"}],"profile":"typaxis.machine-pdf/header-footer-1","rows":[{"fixture_ids":["header-footer-1.combined"],"id":"m3-header-footer-1-combined","test":"machine_tests::machine_header_footer_1_combined_public_profile"}],"verification_commands":["cargo test --manifest-path workspace/Cargo.toml --package typaxis-cli machine --locked","cargo test --manifest-path workspace/Cargo.toml --package typaxis-document-package --locked","python3 schemas/validate.py"]}